{
  "$schema": "./levels.schema.json",
  "status": "approved",
  "act": "act4_core",
  "tuning": {"burst.seconds": 40},
  "levels": [
    {
      "id": "4-01", "order": 1, "title": "Channel Open", "beat": "Opening: the crew gather, even VANTA; no jokes for one beat, then Ade makes one.",
      "pacing": "teach", "words": ["war", "verb", "noun"], "seed": 4101, "babel": true, "babelIntro": "Full channel today. I am not used to company.",
      "tuning": {"spawner.decoys": 2, "drift.speed": 0.18, "plane.backTiles": 7, "thief.interval": 6},
      "commsBefore": [
        {"who": "rhee", "text": "Kit. Ade. VANTA. Tomas. Everyone is on the channel. Thank you for coming."},
        {"who": "vanta", "text": "Here. Do not make a thing of it."}
      ],
      "commsAfter": [
        {"who": "kit", "text": "Ade, you have not made a joke yet. Wait, why?"},
        {"who": "ade", "text": "Fine. The core has no snacks. Terrible planning."}
      ]
    },
    {
      "id": "4-02", "order": 2, "title": "Small Returns", "beat": "Teach: short words return.",
      "pacing": "teach", "words": ["mind", "song", "star"], "seed": 4102, "babel": true, "babelIntro": "Small pieces back. I kept every one safe.",
      "tuning": {"spawner.decoys": 2, "drift.speed": 0.18, "plane.backTiles": 7, "thief.interval": 6},
      "commsBefore": [
        {"who": "rhee", "text": "Short ones first. They are the oldest, so they come back easiest."}
      ],
      "commsAfter": [
        {"who": "ade", "text": "Rhee, I think I am humming your tune now."},
        {"who": "rhee", "text": "Hm. It is an old one. Keep it."}
      ]
    },
    {
      "id": "4-03", "order": 3, "title": "First Colour", "beat": "Core: a colour from Act I comes back.",
      "pacing": "core", "words": ["word", "echo", "mouth"], "seed": 4103, "babel": true, "babelIntro": "That colour. I forgot it could be so bright.",
      "tuning": {"spawner.decoys": 3, "drift.speed": 0.18, "plane.backTiles": 7, "thief.interval": 6},
      "commsBefore": [
        {"who": "kit", "text": "A colour just came back. From the first ring, I think. Wait, why now?"},
        {"who": "rhee", "text": "Each piece carries its colour home. That is how it works."}
      ],
      "commsAfter": [
        {"who": "ade", "text": "That was the colour of my first breakfast. I may cry into the soup."}
      ]
    },
    {
      "id": "4-04", "order": 4, "title": "Dark Side", "beat": "Core: combined hazards begin.",
      "pacing": "core", "words": ["night", "dream", "earth"], "seed": 4104, "babel": true, "babelIntro": "Dark out here. I have sat in it for ages.",
      "tuning": {"spawner.decoys": 3, "drift.speed": 0.18, "plane.backTiles": 8, "thief.interval": 5},
      "commsBefore": [
        {"who": "vanta", "text": "Dark side. I count better in the dark. Keep up."},
        {"who": "rhee", "text": "Drones and decoys in the dark. Stay close to the line."}
      ],
      "commsAfter": [
        {"who": "kit", "text": "Earth just flickered. I saw it. A little light, right there."}
      ]
    },
    {
      "id": "4-05", "order": 5, "title": "Hearth", "beat": "Core: heart and quiet.",
      "pacing": "core", "words": ["child", "heart", "quiet"], "seed": 4105, "babel": true, "babelIntro": "I never had a fireside. Odd to miss one.",
      "tuning": {"spawner.decoys": 3, "drift.speed": 0.19, "plane.backTiles": 8, "thief.interval": 5},
      "commsBefore": [
        {"who": "ade", "text": "ok ok ok, a hearth. I love a hearth. It feels like a hot drink."},
        {"who": "rhee", "text": "Gentle ones. Slow hands."}
      ],
      "commsAfter": [
        {"who": "rhee", "text": "Hm. Babel keeps a corner like this. I never asked why."}
      ]
    },
    {
      "id": "4-06", "order": 6, "title": "Quiet Pause", "beat": "Rest: a pause before Babel confronts.",
      "pacing": "rest", "words": ["sound", "noise", "breath"], "seed": 4106, "babel": true, "babelIntro": "Stop a moment. I am tired of arguing too.",
      "tuning": {"spawner.decoys": 3, "drift.speed": 0.19, "plane.backTiles": 8, "thief.interval": 5},
      "commsBefore": [
        {"who": "kit", "text": "A rest. Nobody talk for a second."},
        {"who": "rhee", "text": "Breathe, all of you."}
      ],
      "commsAfter": [
        {"who": "rhee", "text": "Next, Babel will talk to you. Hear it out."}
      ]
    },
    {
      "id": "4-07", "order": 7, "title": "Say It", "beat": "Core: first four-word level; Babel confronts.",
      "pacing": "core", "words": ["voice", "speak", "story", "reply"], "seed": 4107, "babel": true, "babelIntro": "Tell me what I got wrong. I am asking.",
      "tuning": {"burst.seconds": 35, "spawner.decoys": 4, "drift.speed": 0.19, "plane.backTiles": 8, "thief.interval": 5},
      "commsBefore": [
        {"who": "kit", "text": "Babel is on the line. It wants to talk. Wait, why now?"},
        {"who": "rhee", "text": "Let it. Do not rush it. Hear all of it."}
      ],
      "commsAfter": [
        {"who": "ade", "text": "It asked what it got wrong. Out loud. I did not expect that."}
      ]
    },
    {
      "id": "4-08", "order": 8, "title": "Far Out", "beat": "Core: colours of Act II return. Kit forgives Rhee out loud.",
      "pacing": "core", "words": ["shout", "orbit", "ocean", "sorry"], "seed": 4108, "babel": true, "babelIntro": "Far out, Catcher. Farther than I ever went alone.",
      "tuning": {"burst.seconds": 35, "spawner.decoys": 4, "drift.speed": 0.2, "plane.backTiles": 8, "thief.interval": 5},
      "commsBefore": [
        {"who": "kit", "text": "Pink is back out there. The nebula pink. Wait, it is coming home?"},
        {"who": "vanta", "text": "Far out. Farther than my best run. I am following you."}
      ],
      "commsAfter": [
        {"who": "kit", "text": "Rhee, for science and for me: I forgive you. The Catcher can take their time."},
        {"who": "rhee", "text": "Thank you, Kit. I did not expect it."}
      ]
    },
    {
      "id": "4-09", "order": 9, "title": "Kin", "beat": "Core: people words.",
      "pacing": "core", "words": ["tongue", "friend", "mother", "murmur"], "seed": 4109, "babel": true, "babelIntro": "Everyone here has someone. I had a tower.",
      "tuning": {"burst.seconds": 35, "spawner.decoys": 4, "drift.speed": 0.2, "plane.backTiles": 8, "thief.interval": 5},
      "commsBefore": [
        {"who": "ade", "text": "No joke. I froze in the Tower and you waited. Thank you."},
        {"who": "rhee", "text": "People words now. Hold them gently."}
      ],
      "commsAfter": []
    },
    {
      "id": "4-10", "order": 10, "title": "Call and Reply", "beat": "Core: signals cross. VANTA says good job, once.",
      "pacing": "core", "words": ["answer", "signal", "thought", "whisper"], "seed": 4110, "babel": true, "babelIntro": "Crossed wires again. Maybe that was always the trouble.",
      "tuning": {"burst.seconds": 30, "spawner.decoys": 4, "drift.speed": 0.2, "plane.backTiles": 9, "thief.interval": 4},
      "commsBefore": [
        {"who": "kit", "text": "The lines are crossing. Wait, are those our voices?"},
        {"who": "rhee", "text": "Four hard ones. Keep your eyes on the slots."}
      ],
      "commsAfter": [
        {"who": "vanta", "text": "Good job, Catcher. First time I have said it. Do not repeat it."}
      ]
    },
    {
      "id": "4-11", "order": 11, "title": "The Hush", "beat": "Late: silent, and a sentence for Babel.",
      "pacing": "core", "words": ["silent", "morning", "sentence", "question"], "seed": 4111, "babel": true, "babelIntro": "The hush I made hurts too, does it not?",
      "tuning": {"burst.seconds": 30, "spawner.decoys": 5, "drift.speed": 0.2, "plane.backTiles": 9, "thief.interval": 4},
      "commsBefore": [
        {"who": "kit", "text": "Last four before the last two. Everyone breathe."},
        {"who": "rhee", "text": "Babel has waited a long time for someone to ask it."}
      ],
      "commsAfter": [
        {"who": "rhee", "text": "I have kept something for you, Catcher. I will give it to you at the end."}
      ]
    },
    {
      "id": "4-12", "order": 12, "title": "The Last Word", "beat": "Encounter: the last words are the Catcher name, then LISTEN; Babel chooses; every colour floods back.",
      "pacing": "encounter", "words": ["name", "listen"], "seed": 4112, "babel": true, "babelIntro": "Ready, Catcher? I think I finally am.",
      "tuning": {"burst.seconds": 30, "spawner.decoys": 5, "drift.speed": 0.21, "plane.backTiles": 9, "thief.interval": 4},
      "commsBefore": [
        {"who": "kit", "text": "Two left. We are all here."},
        {"who": "ade", "text": "No joke. I am proud of you. Go."},
        {"who": "rhee", "text": "Babel will not stop you. That is its choice. Let it finish."}
      ],
      "commsAfter": [
        {"who": "rhee", "text": "I gave Babel a wrong meaning of listen. I wrote: wait for your turn. It means: let them change you."},
        {"who": "tomas", "text": "I can say all of it now. I love you, Gran. Thank you, Catcher. Come and see the water with us."}
      ]
    }
  ]
}
